{
  "$schema": "https://json-schema.org/draft/2020-12/schema",
  "$id": "https://example.com/airesearch/schema/metrics.json",
  "title": "EvalMetrics",
  "type": "object",
  "required": ["run_id", "domain", "scenarios"],
  "properties": {
    "run_id": {"type": "string"},
    "domain": {"type": "string", "enum": ["driving", "robotics", "rl"]},
    "git": {
      "type": "object",
      "properties": {
        "repo": {"type": "string"},
        "commit": {"type": "string"},
        "branch": {"type": "string"}
      },
      "additionalProperties": true
    },
    "policy": {
      "type": "object",
      "properties": {
        "name": {"type": "string"},
        "checkpoint": {"type": "string"}
      },
      "additionalProperties": true
    },
    "scenarios": {
      "type": "array",
      "items": {
        "type": "object",
        "required": ["scenario_id", "success"],
        "properties": {
          "scenario_id": {"type": "string"},
          "success": {"type": "boolean"},
          "ade": {
            "type": "number",
            "description": "Average Displacement Error - mean distance to target waypoints (meters)"
          },
          "fde": {
            "type": "number",
            "description": "Final Displacement Error - distance to final target waypoint (meters)"
          },
          "route_completion": {"type": "number", "minimum": 0, "maximum": 1},
          "collisions": {"type": "integer", "minimum": 0},
          "offroad": {"type": "integer", "minimum": 0},
          "red_light": {"type": "integer", "minimum": 0},
          "return": {"type": "number", "description": "Episode return (cumulative reward)"},
          "steps": {"type": "integer", "description": "Number of steps taken"},
          "final_dist": {"type": "number", "description": "Final distance to target (meters)"},
          "num_waypoints_reached": {"type": "integer", "description": "Number of waypoints reached in episode"},
          "comfort": {
            "type": "object",
            "properties": {
              "max_accel": {"type": "number"},
              "max_jerk": {"type": "number"}
            },
            "additionalProperties": true
          },
          "raw": {"type": "object", "description": "Pass-through raw metrics from ScenarioRunner", "additionalProperties": true}
        },
        "additionalProperties": true
      }
    },
    "summary": {
      "type": "object",
      "description": "Aggregate metrics across all scenarios",
      "properties": {
        "ade_mean": {"type": "number"},
        "ade_std": {"type": "number"},
        "fde_mean": {"type": "number"},
        "fde_std": {"type": "number"},
        "success_rate": {"type": "number"},
        "return_mean": {"type": "number"},
        "steps_mean": {"type": "number"},
        "num_episodes": {"type": "integer"},
        "max_accel_mean": {"type": "number", "description": "Mean of max acceleration across episodes (m/s²)"},
        "max_accel_std": {"type": "number", "description": "Std of max acceleration across episodes"},
        "max_jerk_mean": {"type": "number", "description": "Mean of max jerk across episodes (m/s³)"},
        "max_jerk_std": {"type": "number", "description": "Std of max jerk across episodes"}
      },
      "additionalProperties": true
    }
  },
  "additionalProperties": true
}
